{
  "dataVersion": "0.9.0",
  "stock_out": [
    {
      "id": "ev_stockout_app_1",
      "sector": "app",
      "titleKey": "ev.ev_stockout_app_1.title",
      "descKey": "ev.ev_stockout_app_1.desc",
      "durationHours": 5.4,
      "incomePenaltyPct": 35
    },
    {
      "id": "ev_stockout_app_2",
      "sector": "app",
      "titleKey": "ev.ev_stockout_app_2.title",
      "descKey": "ev.ev_stockout_app_2.desc",
      "durationHours": 3.2,
      "incomePenaltyPct": 35
    },
    {
      "id": "ev_stockout_app_3",
      "sector": "app",
      "titleKey": "ev.ev_stockout_app_3.title",
      "descKey": "ev.ev_stockout_app_3.desc",
      "durationHours": 5.7,
      "incomePenaltyPct": 40
    },
    {
      "id": "ev_stockout_app_4",
      "sector": "app",
      "titleKey": "ev.ev_stockout_app_4.title",
      "descKey": "ev.ev_stockout_app_4.desc",
      "durationHours": 4.3,
      "incomePenaltyPct": 35
    },
    {
      "id": "ev_stockout_fnb_1",
      "sector": "fnb",
      "titleKey": "ev.ev_stockout_fnb_1.title",
      "descKey": "ev.ev_stockout_fnb_1.desc",
      "durationHours": 2.6,
      "incomePenaltyPct": 20
    },
    {
      "id": "ev_stockout_fnb_2",
      "sector": "fnb",
      "titleKey": "ev.ev_stockout_fnb_2.title",
      "descKey": "ev.ev_stockout_fnb_2.desc",
      "durationHours": 4.9,
      "incomePenaltyPct": 40
    },
    {
      "id": "ev_stockout_fnb_3",
      "sector": "fnb",
      "titleKey": "ev.ev_stockout_fnb_3.title",
      "descKey": "ev.ev_stockout_fnb_3.desc",
      "durationHours": 2.1,
      "incomePenaltyPct": 40
    },
    {
      "id": "ev_stockout_fnb_4",
      "sector": "fnb",
      "titleKey": "ev.ev_stockout_fnb_4.title",
      "descKey": "ev.ev_stockout_fnb_4.desc",
      "durationHours": 3.9,
      "incomePenaltyPct": 25
    },
    {
      "id": "ev_stockout_logistics_1",
      "sector": "logistics",
      "titleKey": "ev.ev_stockout_logistics_1.title",
      "descKey": "ev.ev_stockout_logistics_1.desc",
      "durationHours": 5.2,
      "incomePenaltyPct": 30
    },
    {
      "id": "ev_stockout_logistics_2",
      "sector": "logistics",
      "titleKey": "ev.ev_stockout_logistics_2.title",
      "descKey": "ev.ev_stockout_logistics_2.desc",
      "durationHours": 3.4,
      "incomePenaltyPct": 25
    },
    {
      "id": "ev_stockout_logistics_3",
      "sector": "logistics",
      "titleKey": "ev.ev_stockout_logistics_3.title",
      "descKey": "ev.ev_stockout_logistics_3.desc",
      "durationHours": 3.7,
      "incomePenaltyPct": 30
    },
    {
      "id": "ev_stockout_logistics_4",
      "sector": "logistics",
      "titleKey": "ev.ev_stockout_logistics_4.title",
      "descKey": "ev.ev_stockout_logistics_4.desc",
      "durationHours": 5.8,
      "incomePenaltyPct": 20
    }
  ],
  "bidding_war": [
    {
      "id": "ev_bidwar_1",
      "titleKey": "ev.ev_bidwar_1.title",
      "descKey": "ev.ev_bidwar_1.desc",
      "durationHours": 4,
      "extraCompetitorCount": 1,
      "aggressionBoostPct": 20
    },
    {
      "id": "ev_bidwar_2",
      "titleKey": "ev.ev_bidwar_2.title",
      "descKey": "ev.ev_bidwar_2.desc",
      "durationHours": 8,
      "extraCompetitorCount": 1,
      "aggressionBoostPct": 15
    },
    {
      "id": "ev_bidwar_3",
      "titleKey": "ev.ev_bidwar_3.title",
      "descKey": "ev.ev_bidwar_3.desc",
      "durationHours": 3,
      "extraCompetitorCount": 2,
      "aggressionBoostPct": 10
    },
    {
      "id": "ev_bidwar_4",
      "titleKey": "ev.ev_bidwar_4.title",
      "descKey": "ev.ev_bidwar_4.desc",
      "durationHours": 8,
      "extraCompetitorCount": 1,
      "aggressionBoostPct": 15
    },
    {
      "id": "ev_bidwar_5",
      "titleKey": "ev.ev_bidwar_5.title",
      "descKey": "ev.ev_bidwar_5.desc",
      "durationHours": 8,
      "extraCompetitorCount": 2,
      "aggressionBoostPct": 20
    },
    {
      "id": "ev_bidwar_6",
      "titleKey": "ev.ev_bidwar_6.title",
      "descKey": "ev.ev_bidwar_6.desc",
      "durationHours": 3,
      "extraCompetitorCount": 1,
      "aggressionBoostPct": 10
    },
    {
      "id": "ev_bidwar_7",
      "titleKey": "ev.ev_bidwar_7.title",
      "descKey": "ev.ev_bidwar_7.desc",
      "durationHours": 4,
      "extraCompetitorCount": 2,
      "aggressionBoostPct": 25
    },
    {
      "id": "ev_bidwar_8",
      "titleKey": "ev.ev_bidwar_8.title",
      "descKey": "ev.ev_bidwar_8.desc",
      "durationHours": 8,
      "extraCompetitorCount": 1,
      "aggressionBoostPct": 25
    }
  ],
  "daily_contract": [
    {
      "id": "ev_contract_01",
      "tierBand": 1,
      "sector": "fnb",
      "titleKey": "ev.ev_contract_01.title",
      "descKey": "ev.ev_contract_01.desc",
      "durationHours": 24,
      "goal": {
        "type": "collect_income",
        "amount": 8000
      },
      "reward": {
        "tm": 1700,
        "dp": 2
      }
    },
    {
      "id": "ev_contract_02",
      "tierBand": 1,
      "sector": "app",
      "titleKey": "ev.ev_contract_02.title",
      "descKey": "ev.ev_contract_02.desc",
      "durationHours": 24,
      "goal": {
        "type": "win_auction",
        "amount": 1
      },
      "reward": {
        "tm": 1700,
        "dp": 0
      }
    },
    {
      "id": "ev_contract_03",
      "tierBand": 1,
      "sector": "fnb",
      "titleKey": "ev.ev_contract_03.title",
      "descKey": "ev.ev_contract_03.desc",
      "durationHours": 24,
      "goal": {
        "type": "upgrade_operations",
        "amount": 2
      },
      "reward": {
        "tm": 1200,
        "dp": 0
      }
    },
    {
      "id": "ev_contract_04",
      "tierBand": 1,
      "sector": "logistics",
      "titleKey": "ev.ev_contract_04.title",
      "descKey": "ev.ev_contract_04.desc",
      "durationHours": 24,
      "goal": {
        "type": "hire_staff",
        "amount": 2
      },
      "reward": {
        "tm": 1300,
        "dp": 0
      }
    },
    {
      "id": "ev_contract_05",
      "tierBand": 1,
      "sector": "app",
      "titleKey": "ev.ev_contract_05.title",
      "descKey": "ev.ev_contract_05.desc",
      "durationHours": 24,
      "goal": {
        "type": "gain_reputation",
        "amount": 10
      },
      "reward": {
        "tm": 1400,
        "dp": 0
      }
    },
    {
      "id": "ev_contract_06",
      "tierBand": 1,
      "sector": "fnb",
      "titleKey": "ev.ev_contract_06.title",
      "descKey": "ev.ev_contract_06.desc",
      "durationHours": 24,
      "goal": {
        "type": "complete_contracts",
        "amount": 3
      },
      "reward": {
        "tm": 1300,
        "dp": 0
      }
    },
    {
      "id": "ev_contract_07",
      "tierBand": 1,
      "sector": "app",
      "titleKey": "ev.ev_contract_07.title",
      "descKey": "ev.ev_contract_07.desc",
      "durationHours": 24,
      "goal": {
        "type": "collect_income",
        "amount": 8000
      },
      "reward": {
        "tm": 1600,
        "dp": 2
      }
    },
    {
      "id": "ev_contract_08",
      "tierBand": 1,
      "sector": "any",
      "titleKey": "ev.ev_contract_08.title",
      "descKey": "ev.ev_contract_08.desc",
      "durationHours": 24,
      "goal": {
        "type": "win_auction",
        "amount": 2
      },
      "reward": {
        "tm": 1300,
        "dp": 0
      }
    },
    {
      "id": "ev_contract_09",
      "tierBand": 2,
      "sector": "fnb",
      "titleKey": "ev.ev_contract_09.title",
      "descKey": "ev.ev_contract_09.desc",
      "durationHours": 24,
      "goal": {
        "type": "upgrade_operations",
        "amount": 6
      },
      "reward": {
        "tm": 6200,
        "dp": 0
      }
    },
    {
      "id": "ev_contract_10",
      "tierBand": 2,
      "sector": "any",
      "titleKey": "ev.ev_contract_10.title",
      "descKey": "ev.ev_contract_10.desc",
      "durationHours": 24,
      "goal": {
        "type": "hire_staff",
        "amount": 3
      },
      "reward": {
        "tm": 6700,
        "dp": 0
      }
    },
    {
      "id": "ev_contract_11",
      "tierBand": 2,
      "sector": "logistics",
      "titleKey": "ev.ev_contract_11.title",
      "descKey": "ev.ev_contract_11.desc",
      "durationHours": 24,
      "goal": {
        "type": "gain_reputation",
        "amount": 10
      },
      "reward": {
        "tm": 9200,
        "dp": 0
      }
    },
    {
      "id": "ev_contract_12",
      "tierBand": 2,
      "sector": "fnb",
      "titleKey": "ev.ev_contract_12.title",
      "descKey": "ev.ev_contract_12.desc",
      "durationHours": 24,
      "goal": {
        "type": "complete_contracts",
        "amount": 3
      },
      "reward": {
        "tm": 8900,
        "dp": 0
      }
    },
    {
      "id": "ev_contract_13",
      "tierBand": 2,
      "sector": "fnb",
      "titleKey": "ev.ev_contract_13.title",
      "descKey": "ev.ev_contract_13.desc",
      "durationHours": 24,
      "goal": {
        "type": "collect_income",
        "amount": 40000
      },
      "reward": {
        "tm": 7300,
        "dp": 2
      }
    },
    {
      "id": "ev_contract_14",
      "tierBand": 2,
      "sector": "app",
      "titleKey": "ev.ev_contract_14.title",
      "descKey": "ev.ev_contract_14.desc",
      "durationHours": 24,
      "goal": {
        "type": "win_auction",
        "amount": 2
      },
      "reward": {
        "tm": 6900,
        "dp": 0
      }
    },
    {
      "id": "ev_contract_15",
      "tierBand": 2,
      "sector": "fnb",
      "titleKey": "ev.ev_contract_15.title",
      "descKey": "ev.ev_contract_15.desc",
      "durationHours": 24,
      "goal": {
        "type": "upgrade_operations",
        "amount": 5
      },
      "reward": {
        "tm": 8200,
        "dp": 0
      }
    },
    {
      "id": "ev_contract_16",
      "tierBand": 2,
      "sector": "fnb",
      "titleKey": "ev.ev_contract_16.title",
      "descKey": "ev.ev_contract_16.desc",
      "durationHours": 24,
      "goal": {
        "type": "hire_staff",
        "amount": 1
      },
      "reward": {